{
  "$schema": "http://json-schema.org/draft-07/schema#",
  "$id": "https://example.com/schemas/remote-config.schema.json",
  "title": "Remote Hook Strategy Configuration",
  "description": "Schema for remote configuration of hook strategies in the Upwork Research Agent",
  "type": "object",
  "required": ["schema_version", "min_app_version", "updated_at", "strategies"],
  "additionalProperties": false,
  "properties": {
    "schema_version": {
      "type": "string",
      "description": "Semantic version of the config schema (X.Y.Z format)",
      "pattern": "^\\d+\\.\\d+\\.\\d+$",
      "examples": ["1.0.0", "2.1.3"]
    },
    "min_app_version": {
      "type": "string",
      "description": "Minimum application version required to use this config (X.Y.Z format)",
      "pattern": "^\\d+\\.\\d+\\.\\d+$",
      "examples": ["0.1.0", "1.2.0"]
    },
    "updated_at": {
      "type": "string",
      "description": "ISO 8601 timestamp of last configuration update",
      "format": "date-time",
      "examples": ["2024-01-15T10:30:00Z", "2024-12-31T23:59:59+00:00"]
    },
    "strategies": {
      "type": "array",
      "description": "Array of hook strategy configurations",
      "items": {
        "$ref": "#/definitions/strategy"
      },
      "minItems": 1
    }
  },
  "definitions": {
    "strategy": {
      "type": "object",
      "required": ["id", "name", "description", "examples", "best_for", "status", "ab_weight"],
      "additionalProperties": false,
      "properties": {
        "id": {
          "type": "string",
          "description": "Unique identifier for the strategy (kebab-case recommended)",
          "minLength": 1,
          "examples": ["social-proof", "contrarian", "immediate-value"]
        },
        "name": {
          "type": "string",
          "description": "Display name of the strategy",
          "minLength": 1,
          "maxLength": 100,
          "examples": ["Social Proof", "Contrarian Approach", "Immediate Value"]
        },
        "description": {
          "type": "string",
          "description": "Detailed description of when and how to use this strategy",
          "minLength": 1,
          "maxLength": 500,
          "examples": ["Build credibility by referencing similar past projects and client outcomes"]
        },
        "examples": {
          "type": "array",
          "description": "Example hooks demonstrating this strategy",
          "items": {
            "type": "string",
            "minLength": 1
          },
          "minItems": 1,
          "maxItems": 5,
          "examples": [
            ["I recently completed a similar project for [client]..."],
            ["Most freelancers would approach this by... but I'd take a different angle..."]
          ]
        },
        "best_for": {
          "type": "string",
          "description": "Description of ideal use cases for this strategy",
          "minLength": 1,
          "maxLength": 200,
          "examples": [
            "Projects where you have highly relevant past experience",
            "Clients who have tried multiple approaches unsuccessfully"
          ]
        },
        "status": {
          "type": "string",
          "description": "Current lifecycle status of the strategy",
          "enum": ["active", "deprecated", "retired"],
          "examples": ["active", "deprecated"]
        },
        "ab_weight": {
          "type": "number",
          "description": "A/B testing weight for this strategy (0.0 = never selected, 1.0 = always selected when all others are 0.0)",
          "minimum": 0.0,
          "maximum": 1.0,
          "examples": [0.2, 0.5, 1.0]
        }
      }
    }
  }
}
